{
  "id": "04ea3db8-e42a-4e18-b98d-cc447e3f9a57",
  "name": "Calculus 201",
  "description": "Advanced differentiation and integration",
  "departmentId": "1fc91124-cd2a-4fae-9ae4-40368d80982d",
  "courseListingId": "cef52efb-b3fd-4450-9960-1745026a99d1",
  "courseNumber": "67890",
  "sectionName": "Sole"
}
