{
  "id": "83034b0a-bf71-4495-b642-2e998f721e5d",
  "name": "Calculus 101",
  "description": "Basic differentiation and integration",
  "departmentId": "1fc91124-cd2a-4fae-9ae4-40368d80982d",
  "courseListingId": "c03bcba3-a6a0-4251-b316-0631bb2e6f21",
  "courseNumber": "12345",
  "sectionName": "Main"
}
