{
  "id": "aabf7f46-9a38-4c72-b3b1-45a55077436a",
  "name": "Intro to Palaeontology",
  "description": "Study of ancient life",
  "departmentId": "1566841c-51ce-4d4c-aa09-0ea21b00904a",
  "courseListingId": "1049e672-dcde-4c7c-b95b-edf9f60c6cbd",
  "courseNumber": "24680",
  "sectionName": "Sole"
}
